{
  "id": "data_stats",
  "type": "plot",
  "bbox_norm": {
    "x0": 0.0,
    "y0": 0.0,
    "x1": 1.0,
    "y1": 1.0
  },
  "name": "Plot with Data and Stats",
  "refs": {
    "encoding": "encoding.json",
    "theme": "theme.json",
    "data": "data/",
    "stats": "stats/stats.json"
  },
  "created_at": "2025-12-19T21:51:54.934101",
  "modified_at": "2025-12-19T21:51:54.935933"
}
