{
  "id": "multi_panel",
  "type": "figure",
  "bbox_norm": {
    "x0": 0.0,
    "y0": 0.0,
    "x1": 1.0,
    "y1": 1.0
  },
  "name": "Multi-Panel Figure",
  "size_mm": {
    "width": 170,
    "height": 130
  },
  "children": [
    "plot_A",
    "plot_B",
    "plot_C",
    "plot_D"
  ],
  "refs": {
    "encoding": "encoding.json",
    "theme": "theme.json",
    "data": "data/",
    "stats": "stats/stats.json"
  },
  "created_at": "2025-12-19T21:51:54.257680",
  "modified_at": "2025-12-19T21:51:54.281393"
}
