{
  "id": "rendered_plot",
  "type": "plot",
  "bbox_norm": {
    "x0": 0.0,
    "y0": 0.0,
    "x1": 1.0,
    "y1": 1.0
  },
  "name": "Sample Time Series",
  "size_mm": {
    "width": 120,
    "height": 80
  },
  "refs": {
    "encoding": "encoding.json",
    "theme": "theme.json",
    "data": "data/",
    "stats": "stats/stats.json"
  },
  "created_at": "2025-12-20T06:09:59.285077",
  "modified_at": "2025-12-20T06:09:59.288743"
}
